_id,blog_title,blog_description,blog_image,blog_slug,tags[0],tags[1],tags[2],status,date,author,category_id,__v
6703b0e038cf7392f782ec29,Laborum odit archite,"<h2 style=""margin-right: 0px; margin-bottom: 10px; margin-left: 0px; padding: 0px; font-family: DauphinPlain; font-size: 24px; line-height: 24px; color: rgb(0, 0, 0);"">Where can I get some?</h2><p style=""margin-right: 0px; margin-bottom: 15px; margin-left: 0px; padding: 0px; text-align: justify; color: rgb(0, 0, 0); font-family: &quot;Open Sans&quot;, Arial, sans-serif; font-size: 14px;"">There are many variations of passages of Lorem Ipsum available, but the majority have suffered alteration in some form, by injected humour, or randomised words which don't look even slightly believable. If you are going to use a passage of Lorem Ipsum, you need to be sure there isn't anything embarrassing hidden in the middle of text. All the Lorem Ipsum generators on the Internet tend to repeat predefined chunks as necessary, making this the first true generator on the Internet. It uses a dictionary of over 200 Latin words, combined with a handful of model sentence structures, to generate Lorem Ipsum which looks reasonable. The generated Lorem Ipsum is therefore always free from repetition, injected humour, or non-characteristic words etc.</p>",17282985711277.jpg,laborum-odit-archite,670107af89d5bd8751bd29fc,67038e0b47a0c52bdafcf5a1,6703ae4ebef145d2469f5b0c,true,2024-10-07T09:58:56.137Z,Admin,66d0dfd8467f14257979256e,0
6703b11638cf7392f782ec2b,Eveniet qui nesciun,"<h2 style=""margin-right: 0px; margin-bottom: 10px; margin-left: 0px; padding: 0px; font-family: DauphinPlain; font-size: 24px; line-height: 24px; color: rgb(0, 0, 0);"">Why do we use it?</h2><p style=""margin-right: 0px; margin-bottom: 15px; margin-left: 0px; padding: 0px; text-align: justify; color: rgb(0, 0, 0); font-family: &quot;Open Sans&quot;, Arial, sans-serif; font-size: 14px;"">It is a long established fact that a reader will be distracted by the readable content of a page when looking at its layout. The point of using Lorem Ipsum is that it has a more-or-less normal distribution of letters, as opposed to using 'Content here, content here', making it look like readable English. Many desktop publishing packages and web page editors now use Lorem Ipsum as their default model text, and a search for 'lorem ipsum' will uncover many web sites still in their infancy. Various versions have evolved over the years, sometimes by accident, sometimes on purpose (injected humour and the like).</p>",17282951902205.jpg,molestiae-voluptates,670107af89d5bd8751bd29fc,67038e0b47a0c52bdafcf5a1,6703ae4ebef145d2469f5b0c,true,2024-10-07T09:59:50.222Z,Admin,66d0dfd0467f14257979256b,0
6703b13d38cf7392f782ec2d,Modi sit sed quisqua,"<h2 style=""margin-right: 0px; margin-bottom: 10px; margin-left: 0px; padding: 0px; font-family: DauphinPlain; font-size: 24px; line-height: 24px; color: rgb(0, 0, 0);"">What is Lorem Ipsum?</h2><p style=""margin-right: 0px; margin-bottom: 15px; margin-left: 0px; padding: 0px; text-align: justify; color: rgb(0, 0, 0); font-family: &quot;Open Sans&quot;, Arial, sans-serif; font-size: 14px;""><strong style=""margin: 0px; padding: 0px;"">Lorem Ipsum</strong>&nbsp;is simply dummy text of the printing and typesetting industry. Lorem Ipsum has been the industry's standard dummy text ever since the 1500s, when an unknown printer took a galley of type and scrambled it to make a type specimen book. It has survived not only five centuries, but also the leap into electronic typesetting, remaining essentially unchanged. It was popularised in the 1960s with the release of Letraset sheets containing Lorem Ipsum passages, and more recently with desktop publishing software like Aldus PageMaker including versions of Lorem Ipsum.</p>",17282952291524.jpg,modi-sit-sed-quisqua,670107af89d5bd8751bd29fc,6703ae4ebef145d2469f5b0c,,true,2024-10-07T10:00:29.153Z,Admin,66d0f2fd57fcaa406e67d2f6,0
6703ea7c10d9920db2d3b429,Soluta similique qua,<p>loewe</p>,17284699197248.jpg,soluta-similique-qua,670107af89d5bd8751bd29fc,67038e0b47a0c52bdafcf5a1,6703ae4ebef145d2469f5b0c,true,2024-10-07T14:04:44.662Z,Admin,66d0dfd0467f14257979256b,0
6703ea9510d9920db2d3b42d,Aliquip omnis volupt,<p>loewe</p>,17284698646392.jpg,aliquip-omnis-volupt,670107af89d5bd8751bd29fc,67038e0b47a0c52bdafcf5a1,6703ae4ebef145d2469f5b0c,true,2024-10-07T14:05:09.766Z,Admin,66d0dfd0467f14257979256b,0
6703eaa710d9920db2d3b42f,Eum nulla quis dolor,<p>loewe</p>,17283099271503.jpg,eum-nulla-quis-dolor,670107af89d5bd8751bd29fc,67038e0b47a0c52bdafcf5a1,6703ae4ebef145d2469f5b0c,true,2024-10-07T14:05:27.153Z,Admin,66d0dfd0467f14257979256b,0
6705626becc02c2777f53c1b,Vero consequat Iust,"Velit, est ea incidi.",17284061237777.jpg,vero-consequat-iust,670107af89d5bd8751bd29fc,6703c86bfe30d00061df3716,,false,2024-10-08T16:48:43.781Z,Admin,66d0dfdf467f142579792571,0
67063a6671f287accbfd4a67,Ut nisi dolor aliqua,Qui velit quia rerum.,17284614148740.jpg,in-asperiores-autem,670107af89d5bd8751bd29fc,6703ae4ebef145d2469f5b0c,,true,2024-10-09T08:10:14.879Z,Admin,66d2eb0ee2a9ceeaae7b9b00,0
